<?xml version="1.0" encoding="UTF-8"?>
<method xmlns="http://serialize.q.com.cn" xmlns:xsi="http://www.w3.org/2001/XMLSchema-instance"
	xsi:schemaLocation="http://serialize.q.com.cn http://www.q.net/xsd/q-serialize.xsd"
	interfaceName="q.serialize.album.AlbumService" interfaceVersion="1.0.0">

	<methodCall name="addAlbum" apiName="taobao.album.add">
		<params>
			<param>
				<type>
					<array>
						<type class="q.serialize.mock.domain.Pojo">
							<struct>
								<member name="title" apiName="name" type="string" />
								<member name="is3D" apiName="is_3D" type="boolean" />
								<member name="resultCount" apiName="result_count" type="int" />
							</struct>
						</type>
					</array>
				</type>
			</param>
		</params>
	</methodCall>

	<methodResponse>

	</methodResponse>
</method>