<?xml version="1.0" encoding="UTF-8"?>
<param xmlns="http://serialize.q.com.cn" xmlns:xsi="http://www.w3.org/2001/XMLSchema-instance"
	xsi:schemaLocation="http://serialize.q.com.cn http://www.q.net/xsd/q-serialize.xsd">
	<type>
		<array>
			<type>
				<struct>
					<member name="id" apiName="id" apiType="string" />
					<member name="name" apiName="name" apiType="string" />
					<member name="avatarPath" apiName="avatarPath" apiType="string" />
					<member name="intro" apiName="intro" apiType="string" />
					<member name="groupNum" apiName="groupNum" apiType="int" />
					<member name="joinNum" apiName="joinNum" apiType="int" />
					<member name="time" apiName="screenTime" apiType="string" />
					<member name="createdTime" apiName="createdTime" apiType="string" />
				</struct>
			</type>
		</array>
	</type>
</param>
