<?xml version="1.0" encoding="UTF-8"?>
<param xmlns="http://serialize.q.com.cn" xmlns:xsi="http://www.w3.org/2001/XMLSchema-instance"
	xsi:schemaLocation="http://serialize.q.com.cn http://www.q.net/xsd/q-serialize.xsd">
	<type>
		<array>
			<type>
				<struct>
					<member name="id" apiName="id" apiType="string" />
					<member name="time" apiName="screenTime" apiType="string" />
					<member name="content" apiName="text" apiType="string" />
					<member name="picturePath" apiName="picturePath" apiType="string" />
					<member name="fav" apiName="favorited" apiType="boolean" />
					<member name="fromName" apiName="fromName" apiType="string" />
					<member name="fromUrl" apiName="fromUrl" apiType="string" />
					<member name="replyNum" apiName="replyNum" apiType="int" />
					<member name="retweetNum" apiName="retweetNum" apiType="int" />
					<member name="people" apiName="people">
						<type>
							<struct>
								<member name="id" apiName="id" apiType="string" />
								<member name="realName" apiName="screenName" apiType="string" />
								<member name="avatarPath" apiName="avatarPath" apiType="string" />
							</struct>
						</type>
					</member>
					<member name="quote" apiName="quote">
						<type>
							<struct>
								<member name="id" apiName="id" apiType="string" />
								<member name="time" apiName="screenTime" apiType="string" />
								<member name="content" apiName="text" apiType="string" />
								<member name="picturePath" apiName="picturePath" apiType="string" />
								<member name="fav" apiName="favorited" apiType="boolean" />
								<member name="fromName" apiName="fromName" apiType="string" />
								<member name="fromUrl" apiName="fromUrl" apiType="string" />
								<member name="replyNum" apiName="replyNum" apiType="int" />
								<member name="retweetNum" apiName="retweetNum" apiType="int" />
								<member name="people" apiName="people">
									<type>
										<struct>
											<member name="id" apiName="id" apiType="string" />
											<member name="realName" apiName="screenName" apiType="string" />
											<member name="avatarPath" apiName="avatarPath"
												apiType="string" />
										</struct>
									</type>
								</member>
							</struct>
						</type>
					</member>
				</struct>
			</type>
		</array>
	</type>
</param>
