<?xml version="1.0" encoding="UTF-8"?>
<param xmlns="http://serialize.q.com.cn" xmlns:xsi="http://www.w3.org/2001/XMLSchema-instance" xsi:schemaLocation="http://serialize.q.com.cn http://www.q.net/xsd/q-serialize.xsd">
	<type>
		<struct>
			<member name="is3D" apiName="is_3D" apiType="boolean">
				<switch>
					<case type="boolean" value="true" apiValue="true" />
				</switch>
			</member>
			<member name="title" apiName="title" apiType="string" />
			<member name="z" apiName="z" apiType="int">
				<switch>
					<case type="boolean" value="true" apiValue="1" />
					<case type="boolean" value="false" apiValue="0" />
					<default apiValue="3" />
				</switch>
			</member>
		</struct>
	</type>
</param>
