<?xml version="1.0" encoding="UTF-8"?>
<param xmlns="http://serialize.q.com.cn" xmlns:xsi="http://www.w3.org/2001/XMLSchema-instance"
	xsi:schemaLocation="http://serialize.q.com.cn http://www.q.net/xsd/q-serialize.xsd">
	<type>
		<struct>
			<member name="relations" apiName="relations">
				<type>
					<array>
						<type>
							<struct>
								<member name="id" apiName="id" apiType="string" />
							</struct>
						</type>
					</array>
				</type>
			</member>
			<member name="peoples" apiName="peoples">
				<type>
					<array>
						<type>
							<struct>

								<member name="id" apiName="id" apiType="string" />
								<member name="realName" apiName="screenName" apiType="string" />
								<member name="avatarPath" apiName="avatarPath" apiType="string" />
								<member name="following" apiName="following" apiType="boolean" />
								<member name="relationId" apiName="relationId" apiType="string" />
							</struct>
						</type>
					</array>
				</type>
			</member>
		</struct>
	</type>
</param>
